id,sentence,difficulty,cleaned_text
0,"Les coûts kilométriques réels peuvent diverger sensiblement des valeurs moyennes en fonction du moyen de transport utilisé, du taux d'occupation ou du taux de remplissage, de l'infrastructure utilisée, de la topographie des lignes, du flux de trafic, etc.",C1,cots kilomtriques rels peuvent diverger sensiblement valeurs moyennes fonction moyen transport utilis taux doccupation taux remplissage linfrastructure utilise topographie lignes flux trafic etc
1,"Le bleu, c'est ma couleur préférée mais je n'aime pas le vert!",A1,bleu cest couleur prfre naime vert
2,Le test de niveau en français est sur le site Internet de l'école.,A1,test niveau franais site internet lcole
3,Est-ce que ton mari est aussi de Boston?,A1,estce mari aussi boston
4,"Dans les écoles de commerce, dans les couloirs de places financières, il arrive aujourd'hui de croiser de jeunes adultes de 20 ou 25 ans qui prévoient d'ouvrir une maison d'hôtes ""dans une quinzaine d'années"".",B1,coles commerce couloirs places financires arrive aujourdhui croiser jeunes adultes ans prvoient douvrir maison dhtes quinzaine dannes
5,voilà une autre histoire que j'ai beaucoup aimée.,A2,voil autre histoire jai beaucoup aime
6,Les médecins disent souvent qu'on doit boire un verre de vin rouge après les repas.,A2,mdecins disent souvent quon doit boire verre vin rouge aprs repas
7,"Il est particulièrement observé chez les personnes ayant un besoin de popularité développé, qui considèrent dès lors le moindre signal du smartphone comme un possible indicateur de leur degré de popularité.",B2,particulirement observ chez personnes besoin popularit dvelopp considrent ds lors moindre signal smartphone comme possible indicateur degr popularit
8,J'ai retrouvé le plaisir de manger un oeuf à la coque,A2,jai retrouv plaisir manger oeuf coque
9,"Nous allons bien, nous habitons dans une petite maison ancienne avec un très beau jardin",B1,allons bien habitons petite maison ancienne trs beau jardin
10,Bonjour et bonne année.,A1,bonjour bonne anne
11,La presse s'est abondamment fait l'écho des effets secondaires ressentis par les soignants de moins de 65 ans.,B2,presse sest abondamment fait lcho effets secondaires ressentis soignants moins ans
12,"Pour que le rocher s'ouvre, il faut le toucher avec un brin d'herbe.",B1,rocher souvre faut toucher brin dherbe
13,J'habite une belle ville dans le nord de la France.,A1,jhabite belle ville nord france
14,"Certes il doit répondre aux goûts du consommateur, mais aussi aux capacités de son porte-monnaie.",B2,certes doit rpondre gots consommateur aussi capacits portemonnaie
15,"Ma timidité me quittait dès que je m'éloignais d'Ellénore ; je reprenais alors mes plans habiles et mes profondes combinaisons : mais à peine me retrouvais-je auprès d'elle, que je me sentais de nouveau tremblant et troublé.",C2,timidit quittait ds mloignais dellnore reprenais alors plans habiles profondes combinaisons peine retrouvaisje auprs delle sentais nouveau tremblant troubl
16,Je pense que fréquenter les galeries est la meilleure manière d'éduquer son oeil à l'art contemporain.,B2,pense frquenter galeries meilleure manire dduquer oeil lart contemporain
17,"Le soir, je me cuche tôt parce que je dois être toujours en bonne forme.",A1,soir cuche tt parce dois tre toujours bonne forme
18,"La mère de Raphaël et de Vanessa exprime sa satisfaction : depuis que ses enfants possèdent un portable, ""ça a libéré ma ligne"", déclare-t-elle.",B2,mre raphal vanessa exprime satisfaction depuis enfants possdent portable a a libr ligne dclaretelle
19,Je ne fais pas grand-chose à la maison.,A2,fais grandchose maison
20,Elle ajoute qu'une interdiction totale est impossible à gérer.,B2,ajoute quune interdiction totale impossible grer
21,"Sans plus d'hésitation, il tourna vers la gauche ; son pas sonnait sur la terre durcie, et ce bruit cadencé, monotone, assoupissait en le berçant, le tumulte de son esprit.",C2,sans plus dhsitation tourna vers gauche sonnait terre durcie bruit cadenc monotone assoupissait berant tumulte esprit
22,"Comme le signale l'expression ""lingua franca"", le français a été pendant très longtemps la langue internationale, eu égard à notre rayonnement politique aussi bien que culturel",C2,comme signale lexpression lingua franca franais a pendant trs longtemps langue internationale gard rayonnement politique aussi bien culturel
23,Je ne t'ai pas téléphoné parce que j'ai eu trop de travail.,B1,tai tlphon parce jai trop travail
24,C'est peut-être ça que vous cherchez ?,A2,cest peuttre a cherchez
25,"Qu'est-ce qui peut bien poser problème dans ces petits livrets pourtant plutôt attractifs pour que seuls 23, 4 % de leurs détenteurs arrivent au bout ?",C2,questce peut bien poser problme petits livrets pourtant plutt attractifs seuls leurs dtenteurs arrivent bout
26,Je consulte d'habitude ma messagerie. Et puis je prends un café.,A1,consulte dhabitude messagerie puis prends caf
27,Nous sommes en train de dîner.,A2,train dner
28,"En fait, je trouve que l'éducation est une bonne chose.",B1,fait trouve lducation bonne chose
29,As-tu besoin de quelque chose?,A1,astu besoin quelque chose
30,"Perpétuel clandestin, c'est muni d'un faux titre de séjour, photocopie de la carte de résident d'un copain-complice, qu'il avait ensuite sillonné l'Hexagone, au bon vouloir d'employeurs peu scrupuleux.",C1,perptuel clandestin cest muni dun faux titre sjour photocopie carte rsident dun copaincomplice quil ensuite sillonn lhexagone bon vouloir demployeurs peu scrupuleux
31,"Le mariage mixte apparaît comme le lieu privilégié ou les cultures s'affrontent, dialoguent et se fondent.",B2,mariage mixte apparat comme lieu privilgi cultures saffrontent dialoguent fondent
32,"Assis en terrasse dans le quartier touristique du Vieux Lyon, James sirote une limonade bien fraîche",B2,assis terrasse quartier touristique vieux lyon james sirote limonade bien frache
33,"La chronologie antique ne prend sens que sur un large pourtour de la Méditerranée, de même que ce découpage spatial n'est pertinent comme entité géographique que durant cette période pendant laquelle la mer intérieure n'est pas vécue comme une limite.",C2,chronologie antique prend sens large pourtour mditerrane mme dcoupage spatial nest pertinent comme entit gographique durant cette priode pendant laquelle mer intrieure nest vcue comme limite
34,"En voici un des moins obscurs : ""Plus nous devenons maîtres de la biosphère, plus nous en devenons dépendants ; plus nous la dégradons, plus nous dégradons nos vies5.",C2,voici moins obscurs plus devenons matres biosphre plus devenons dpendants plus dgradons plus dgradons vies
35,"C'est le début de troubles qui se poursuivent et s'étendent au reste du territoire tout au long du mois de septembre les fameuses ""Journées de septembre"" amplifiés le refus de Guillaume 1er de considérer les revendications des insurgés",B2,cest dbut troubles poursuivent stendent reste territoire tout long mois septembre fameuses journes septembre amplifis refus guillaume er considrer revendications insurgs
36,Les filles s'étaient fait des colliers en fruits rouges qui ressemblaient à des perles.,B2,filles staient fait colliers fruits rouges ressemblaient perles
37,Je reste avec toi.,A1,reste
38,Un revenu devient donc une nécessité pour que l'Homme puisse accéder à la satisfaction d'avoir comblé ses désirs,C2,revenu devient donc ncessit lhomme puisse accder satisfaction davoir combl dsirs
39,Tu mangeas les petits fruits dès que tu les eus cueillis,C2,mangeas petits fruits ds cueillis
40,"Ben, on est tous débordés quoi.",A1,ben tous dbords quoi
41,"Un petit garçon : Ben trois dans un nid et dans l'autre, y'en a deux",A2,petit garon ben trois nid lautre yen a deux
42,J'ai été en forme toute la matinée.,A2,jai forme toute matine
43,"L'ordinateur peut aussi répondre à des interruptions qui lui permettent d'exécuter des programmes de réponses spécifiques à chacune, puis de reprendre l'exécution séquentielle du programme interrompu.",C2,lordinateur peut aussi rpondre interruptions permettent dexcuter programmes rponses spcifiques chacune puis reprendre lexcution squentielle programme interrompu
44,Il a plu et j'ai attendu l'autobus.,A2,a plu jai attendu lautobus
45,"Dans d'autres cas il s'agit de limites relatives, basées sur un taux de croissance démographique de référence, valables là aussi uniquement hors centres ou pondérées en fonction du degré de centralité.",C2,dautres cas sagit limites relatives bases taux croissance dmographique rfrence valables aussi uniquement hors centres pondres fonction degr centralit
46,C'est bien !,A1,cest bien
47,"En 2007, moins de 8% des déchets des entreprises ont fait l'objet d'une collecte sélective.",B2,moins dchets entreprises fait lobjet dune collecte slective
48,Les médecins des donneurs vous conseilleront volontiers dans un tel cas vous renseigneront par rapport aux dons de sang.,C1,mdecins donneurs conseilleront volontiers tel cas renseigneront rapport dons sang
49,Le plus inquiétant c'est que la Scandinavie avait déjà battu des records de chaleur pendant l'été 2018,A2,plus inquitant cest scandinavie dj battu records chaleur pendant lt
50,J'aime le ski.,A1,jaime ski
51,"""Malheureusement, il semble désormais évident qu'il n'y a pas de voie pour obtenir une confirmation"", a écrit Neera Tanden à Joe Biden en retirant sa candidature",B2,malheureusement semble dsormais vident quil ny a voie obtenir confirmation a crit neera tanden joe biden retirant candidature
52,Pourquoi l'oisillon se retrouve-t-il seul dans la forêt ?,A1,pourquoi loisillon retrouvetil seul fort
53,Elle est née quel jour ?,A1,quel jour
54,"Il existe effectivement, des êtres humains qui possèdent une quantité de pouvoir importante et qui contraignent l'humanité à travailler en créant un cercle vicieux qui fait du travail une nécessité pour accéder à ses propres désirs",C2,existe effectivement tres humains possdent quantit pouvoir importante contraignent lhumanit travailler crant cercle vicieux fait travail ncessit accder propres dsirs
55,Une bouchée de : cette expression fait référence à la quantité d'un aliment qu'on met dans la bouche en une fois.,B1,bouche cette expression fait rfrence quantit dun aliment quon met bouche fois
56,"Si tu respectait les indications plus sérieusement, tu trouverais plus facilement ton chemin à travers ces ruelles.",B2,si respectait indications plus srieusement trouverais plus facilement chemin travers ruelles
57,"Aussitôt que Julie eut découvert la vérité, elle fut furieuse",C2,aussitt julie dcouvert vrit furieuse
58,Pile au moment où on a le plus besoin de réconfort,A2,pile moment o a plus besoin rconfort
59,"Le train, en son temps, était également craint. Brigitte Munier Les robots suscitent l'enthousiasme des Occidentaux, mais aussi leur angoisse: au lieu de les concevoir comme de simples outils ou, à la manière japonaise, tels d'amicaux auxiliaires, ils craignent des compétiteurs menaçant leur avenir.",C1,train temps tait galement craint brigitte munier robots suscitent lenthousiasme occidentaux aussi angoisse lieu concevoir comme simples outils manire japonaise tels damicaux auxiliaires craignent comptiteurs menaant avenir
60,Je viens d'emménager dans ma nouvelle maison.,A2,viens demmnager nouvelle maison
61,"Et cette année, ça défile !",B1,cette anne a dfile
62,"Compte tenu de cette configuration, cette zone est peu adaptée à des mesures de terrain pour limiter la diffusion des campagnols terrestres ; les axes routiers ne représentant pas une barrière très forte pour cette espèce, on peut aussi penser qu'un tel résultat est un artéfact dû à la coupure artificielle d'une seule tache de prairie.",C1,compte tenu cette configuration cette zone peu adapte mesures terrain limiter diffusion campagnols terrestres axes routiers reprsentant barrire trs forte cette espce peut aussi penser quun tel rsultat artfact coupure artificielle dune seule tache prairie
63,"Après mûre réflexion, la Commission européenne a eu une idée brillante: s'attaquer à un nouveau chantier, qui avait jusque-là bizarrement échappé à sa sagacité légendaire.",C1,aprs mre rflexion commission europenne a ide brillante sattaquer nouveau chantier jusquel bizarrement chapp sagacit lgendaire
64,"Avec de l'expérience, le télévendeur peut devenir animateur d'un pôle de télévendeurs, superviseur d'équipe, chef de plateau.",B1,lexprience tlvendeur peut devenir animateur dun ple tlvendeurs superviseur dquipe chef plateau
65,"Et toi, qu'est-ce que tu vas faire ?",A2,questce vas faire
66,Les valorisations boursières des sociétés Internet comme AMAZON,C2,valorisations boursires socits internet comme amazon
67,"Sur d'autres, on entendait une série de détonations, tandis que des contestataires scandaient: ""notre révolte doit réussir"".",C1,dautres entendait srie dtonations tandis contestataires scandaient rvolte doit russir
68,Les baby-boomers en sont convaincus: tout peut recommencer à 50 ans.,C1,babyboomers convaincus tout peut recommencer ans
69,"Rien n'était si beau, si leste, si brillant, si bien ordonné que les deux armées.",B1,rien ntait si beau si leste si brillant si bien ordonn deux armes
70,Comment t'appelles-tu ?,A1,comment tappellestu
71,"Largué par la sonde européenne Rosetta, le petit robot avait atterri mercredi en fin d'après-midi sur le noyau de la comète Tchourioumov-Guérassimenko, une première de l'histoire spatiale.",B2,largu sonde europenne rosetta petit robot atterri mercredi fin daprsmidi noyau comte tchourioumovgurassimenko premire lhistoire spatiale
72,"Elle pendit son linge au dossier d'une chaise, elle demeura debout, tournant, examinant les meubles, frappée d'une telle stupeur, que ses larmes ne coulaient plus ; il lui restait un sou sur les quatre sous gardés pour le lavoir. Puis, entendant rire à la fenêtre Étienne et Claude, déjà consolés, elle s'approcha, prit leurs têtes sous ses bras, s'oublia un instant devant cette chaussée grise, où elle avait vu, le matin, s'éveiller le peuple ouvrier, le travail géant de Paris ; à cette heure, le pavé échauffé par les besognes du jour allumait une réverbération ardente au-dessus de la ville, derrière le mur de l'octroi ; c'était sur ce pavé, dans cet air de fournaise, qu'on la jetait toute seule avec les petits et elle enfila d'un regard les boulevards extérieurs, à droite, à gauche, s'arrêtant aux deux bouts, prise d'une épouvante sourde, comme si sa vie, désormais, allait tenir là, entre un abattoir et un hôpital.",C2,pendit linge dossier dune chaise demeura debout tournant examinant meubles frappe dune telle stupeur larmes coulaient plus restait sou quatre sous gards lavoir puis entendant rire fentre tienne claude dj consols sapprocha prit leurs ttes sous bras soublia instant devant cette chausse grise o vu matin sveiller peuple ouvrier travail gant paris cette heure pav chauff besognes jour allumait rverbration ardente audessus ville derrire mur loctroi ctait pav cet air fournaise quon jetait toute seule petits enfila dun regard boulevards extrieurs droite gauche sarrtant deux bouts prise dune pouvante sourde comme si vie dsormais allait tenir entre abattoir hpital
73,"Le sérum, qui a pâti de la comparaison avec ses concurrents Pfizer et Moderna, est désormais considéré comme aussi efficace pour prévenir le risque d'hospitalisation.",C1,srum a pti comparaison concurrents pfizer moderna dsormais considr comme aussi efficace prvenir risque dhospitalisation
74,"J'ai identifié trois peurs fondamentales du robot: la crainte instinctive du métal contre la chair, la crainte sociétale, presque désespérée du robot qui va voler le travail de l'homme, et, enfin, la crainte identitaire de voir le robot nous dépasser en capacités intellectuelles ou autres.",C2,jai identifi trois peurs fondamentales robot crainte instinctive mtal contre chair crainte socitale presque dsespre robot va voler travail lhomme enfin crainte identitaire voir robot dpasser capacits intellectuelles autres
75,Mais d'autres pourront préférer L'Assassin des échecs ou Les Annales du Kangourou (Editions du Kangourou) .,C2,dautres pourront prfrer lassassin checs annales kangourou editions kangourou
76,Vous ferez de la randonnée ?,B1,ferez randonne
77,il y a plus de 50 pays francophones !,A1,a plus pays francophones
78,Ils ont déjà l'obligation de les ramener chez eux.,B1,dj lobligation ramener chez
79,"Un autre : Oui, on leur a bien donné des noms",A2,autre oui a bien donn noms
80,Vous joindrez à votre formulaire les pièces justificatives et documents sous format numérique.,B2,joindrez formulaire pices justificatives documents sous format numrique
81,"Merci, bon voyage.",A1,merci bon voyage
82,"Ce geste, presque insensible, lui fit courir, de la tête aux pieds, un grand frisson sur la peau, et, se tournant vivement, il se jeta sur elle, cherchant la bouche avec ses lèvres et la chair nue avec ses mains.",C2,geste presque insensible fit courir tte pieds grand frisson peau tournant vivement jeta cherchant bouche lvres chair nue mains
83,Il clabaude aux esgourdes des blaireaux enfarinés et des tordus pasteurisés.,C2,clabaude esgourdes blaireaux enfarins tordus pasteuriss
84,"Avec sa nouvelle compagne de quatorze ans sa cadette, il dit ""vivre une renaissance"".",C1,nouvelle compagne quatorze ans cadette dit vivre renaissance
85,"Entre ceux qui ne jurent que par l'introduction de l'informatique dans l'enseignement obligatoire, et ceux qui ont peur que l'on veuille transformer le primaire en une grande école d'informatique, il existe pourtant des pistes pour initier les enseignants et favoriser un passage du périscolaire au scolaire, sans avoir à attendre une réforme du socle commun qui prendra des années.",C2,entre ceux jurent lintroduction linformatique lenseignement obligatoire ceux peur lon veuille transformer primaire grande cole dinformatique existe pourtant pistes initier enseignants favoriser passage priscolaire scolaire sans avoir attendre rforme socle commun prendra annes
86,"Parmi les acteurs du commerce équitable, il faut distinguer les organismes ""labellisateurs"", qui certifient des filières d'importation par produit, et les importateurs - grossistes, détaillants ou réseaux de boutiques, comme Artisans du monde -, qui ont leurs propres contacts avec les producteurs et s'autocontrôlent, faute de mieux.",C1,parmi acteurs commerce quitable faut distinguer organismes labellisateurs certifient filires dimportation produit importateurs grossistes dtaillants rseaux boutiques comme artisans monde leurs propres contacts producteurs sautocontrlent faute mieux
87,Elle peut donc ouvrir d'autres réflexions et finalement devenir très enrichissante.,B2,peut donc ouvrir dautres rflexions finalement devenir trs enrichissante
88,"Ce paysan pleurait et prétendait qu'on lui avait tout pris ; Fabrice lui donna un écu, et il trouva de l'avoine.",B2,paysan pleurait prtendait quon tout pris fabrice donna cu trouva lavoine
89,"La première limite est que les instruments de contingentement spatial pris en compte donnent une idée de la maîtrise ""potentielle"" de l'urbanisation, maîtrise dérivant des possibilités fournies par le cadre légal et stratégique dont chaque canton s'est doté.",C2,premire limite instruments contingentement spatial pris compte donnent ide matrise potentielle lurbanisation matrise drivant possibilits fournies cadre lgal stratgique dont chaque canton sest dot
90,Le petit chat a plu à mes parents,A2,petit chat a plu parents
91,Se prémunir contre l'altération des données et avoir la certitude qu'elles n'ont pas été modifiées lors de leur stockage ou de leur traitement contribue à la qualité des prises de décisions basées sur celles-ci.,C2,prmunir contre laltration donnes avoir certitude quelles nont modifies lors stockage traitement contribue qualit prises dcisions bases cellesci
92,"[.] Nous sommes des joueurs/joués3"".",B2,joueursjous
93,"Quand j'ai lu, j'ai découvert de nouvelles choses surprenantes sur les locataires qui occupaient l'appartement.",B1,quand jai lu jai dcouvert nouvelles choses surprenantes locataires occupaient lappartement
94,Vous avez dit la seule chose intelligente !,A2,dit seule chose intelligente
95,Mon ami ne répond pas au téléphone.,A1,ami rpond tlphone
96,Mon frère Patrice est plus jeune que moi,A2,frere patrice plus jeune
97,"Ils sont en vacances, il n'y a que nous sur cette partie de l'île.",B1,vacances ny a cette partie lle
98,"Quand il y a des nuages avec de la neige qui tombe, c'est qu'il va neiger et qu'il peut y avoir du brouillard, des risques de congélation, de la glace et que la température sera très basse",B1,quand a nuages neige tombe cest quil va neiger quil peut avoir brouillard risques conglation glace temprature trs basse
99,"Un escalier nous conduisit à une large coursive en hauteur qui faisait le tour du bâtiment, desservant une succession de bureaux.",C2,escalier conduisit large coursive hauteur faisait tour btiment desservant succession bureaux
100,"Que vous cherchiez une simple annonce ou un recruteur, vous êtes sûr de ne rater aucune offre d'emploi grâce à notre système d'alerte personnalisé.",B2,cherchiez simple annonce recruteur sr rater aucune offre demploi grce systme dalerte personnalis
101,"Ça nous a donc coûté de l'argent, s'énerve-t-elle.",B1,a a donc cot largent snervetelle
102,Vous vous appelez comment ?,A1,appelez comment
103,"Fabrice, à peine âgé de seize ans, représentait fort bien le chef de la maison.",B2,fabrice peine g seize ans reprsentait fort bien chef maison
104,"Oui, je suis à Paris depuis vingt jours à peine.",A1,oui paris depuis vingt jours peine
105,"L'apprentissage du code et plus largement d'une culture générale du numérique à l'école est une mesure réclamée depuis longtemps par l'Académie des Sciences, soutenue par des acteurs qui comptent dans le secteur numérique, comme la Cnil ou le Conseil national du numérique, et qui figure même dans une proposition de loi de la députée UMP Laure de la Raudière.",C2,lapprentissage code plus largement dune culture gnrale numrique lcole mesure rclame depuis longtemps lacadmie sciences soutenue acteurs comptent secteur numrique comme cnil conseil national numrique figure mme proposition loi dpute ump laure raudire
106,Pourquoi ne pas avoir donné la serviette alors que tu avais déjà les plans ?,B1,pourquoi avoir donn serviette alors dj plans
107,"Quand je rentre, je demande à mes parents si je peux t'appeler pour avoir de tes nouvelles.",A2,quand rentre demande parents si peux tappeler avoir nouvelles
108,"L'important, évidemment, pour les contribuables européens qui voudraient annuler leur dette, c'est que chacun des créditeurs, des créanciers soit traité de la même façon.",B2,limportant videmment contribuables europens voudraient annuler dette cest chacun crditeurs cranciers trait mme faon
109,"Même l'ambassadeur birman aux Nations unies, Kyaw Moe Tun, a rompu de manière spectaculaire avec les généraux putschistes la semaine dernière en appelant à ""mettre fin au coup d'Etat"".",C1,mme lambassadeur birman nations unies kyaw moe tun a rompu manire spectaculaire gnraux putschistes semaine dernire appelant mettre fin coup detat
110,Le directeur aurait donné de nouvelles consignes au personnel.,B2,directeur donn nouvelles consignes personnel
111,Vos regards m'observent.,C2,regards mobservent
112,De nombreux auteurs ont spéculé sur les différents aspects de la personnalité de Léonard.,C1,nombreux auteurs spcul diffrents aspects personnalit lonard
113,"Les conséquences sur la nature sont gravissimes, notamment sur les océans qui contiendraient selon la revue américaine Science plus de 110 millions de tonnes de déchets plastiques.",B2,consquences nature gravissimes notamment ocans contiendraient selon revue amricaine science plus millions tonnes dchets plastiques
114,"Si sept millions de citadins rêvent de refaire leur vie aux champs, tous ne passent pourtant pas à l'acte. ""Il y a toujours un événement déclencheur"", constate la directrice de Changer tout.",B2,si sept millions citadins rvent refaire vie champs tous passent pourtant lacte a toujours vnement dclencheur constate directrice changer tout
115,"Mon père, bien qu'il observât strictement les convenances extérieures, se permettait assez fréquemment des propos légers sur les liaisons d'amour : il les regardait comme des amusements, sinon permis, du moins excusables, et considérait le mariage seul sous un rapport sérieux.",C2,pre bien quil observt strictement convenances extrieures permettait assez frquemment propos lgers liaisons damour regardait comme amusements sinon permis moins excusables considrait mariage seul sous rapport srieux
116,Après tout que lui offre-t-elle à part de l'ennui et une grosse boule d'angoisse au creux du ventre ?,A2,aprs tout offretelle part lennui grosse boule dangoisse creux ventre
117,Leur pavillon mitoyen à Paris était pratiquement neuf quand ils l'avaient acheté.,B2,pavillon mitoyen paris tait pratiquement neuf quand lavaient achet
118,L'émigration galicienne sous-tend l'évolution du peuplement et l'explique en grande partie.,C1,lmigration galicienne soustend lvolution peuplement lexplique grande partie
119,Ces tanières se fondent dans la nature pour être quasiment invisibles.,C1,tanires fondent nature tre quasiment invisibles
120,Les hommes se croient libres alors qu'ils sont contraints ou déterminés par leur nature,C2,hommes croient libres alors quils contraints dtermins nature
