id,sentence,difficulty,cleaned_text
1155,"Au regard des défis posés à la société multiculturelle, le couple mixte se présente comme un laboratoire intensif (de tous les instants) d'échanges, d'analyses, de synthèses, capable d'imaginer des solutions originales applicables à un niveau individuel mais susceptibles d'inspirer les politiques collectives ou dans certains cas d'être transposées à l'échelle de la société.",C1,regard dfis poss socit multiculturelle couple mixte prsente comme laboratoire intensif tous instants dchanges danalyses synthses capable dimaginer solutions originales applicables niveau individuel susceptibles dinspirer politiques collectives certains cas dtre transposes lchelle socit
1156,Nous ne nous attendions pas à un tel buzz.,B1,attendions tel buzz
1157,"Oh, mais attends une seconde !",A2,oh attends seconde
1158,Vous allâtes dans une contrée lointaine pour tout oublier de vos erreurs passées dont seul le commun des mortels ignore.,C2,alltes contre lointaine tout oublier erreurs passes dont seul commun mortels ignore
1159,"La salle commençait à se remplir, on tirait les lorgnettes de leurs étuis, et les abonnés, s'apercevant de loin, se faisaient des salutations.",C2,salle commenait remplir tirait lorgnettes leurs tuis abonns sapercevant loin faisaient salutations
1160,Débuter la journée par un premier repas organisé autour d'une de ces boissons dopantes que l'on sucre preut sembler passablement anecdotique.,C2,dbuter journe premier repas organis autour dune boissons dopantes lon sucre preut sembler passablement anecdotique
1161,Le tas de riz tantant tanta le tas de rats tentés.,C2,tas riz tantant tanta tas rats tents
1162,A t'il parlé d'astuces pratiques pour un bien-être quotidien et d'un questionnement philosophique sur cette quête de l'impossible,B1,a til parl dastuces pratiques bientre quotidien dun questionnement philosophique cette qute limpossible
1163,"Accusé de manger à tous les râteliers, l'élu démissionne.",B2,accus manger tous rteliers llu dmissionne
1164,"Lui qui, enfant, suivait sa mère trappeur, peut encore aujourd'hui emmener son fils de 14 ans chasser, mais dit craindre la réduction des quotas de chasse pour les ours polaires.",C1,enfant suivait mre trappeur peut encore aujourdhui emmener fils ans chasser dit craindre rduction quotas chasse ours polaires
1165,"Un enseignement fondé sur l'expérimentation et la pratique, des objectifs d'apprentissage transversaux, des actions tournées en priorité vers la formation continue des enseignants, menées en collaboration avec la communauté scientifique et professionnelle",C1,enseignement fond lexprimentation pratique objectifs dapprentissage transversaux actions tournes priorit vers formation continue enseignants menes collaboration communaut scientifique professionnelle
1166,"Alors qu'elle revenait du marché à travers la brousse, une femme laisse tomber une cruche et continue son chemin sans s'apercevoir de rien.",A1,alors quelle revenait march travers brousse femme laisse tomber cruche continue chemin sans sapercevoir rien
1167,"Le bébé pleure depuis des heures, il a faim.",A1,bb pleure depuis heures a faim
1168,"Les cadeaux seront déposés à son pied, le soir du 24 ou le 25 décembre au matin",B2,cadeaux dposs pied soir dcembre matin
1169,"Dans cette ville, tout comme à Paris et Londres, les autorités ont déjà décidé de mettre en place des règles pour limiter la durée de location.",B1,cette ville tout comme paris londres autorits dj dcid mettre place rgles limiter dure location
1170,"vec ses livreurs à vélo aux énormes sacs à dos carrés, l'entreprise est devenue incontournable pendant la pandémie.",C1,vec livreurs vlo normes sacs dos carrs lentreprise devenue incontournable pendant pandmie
1171,Depuis combien de temps?,A2,depuis combien temps
1172,Idem pour les voies technologiques.,C1,idem voies technologiques
1173,"Il savait déjà qu'il faut éviter les aliments grossiers, les lourdes venaisons et les boissons fermentées ; il connaissait aussi l'influence bienfaisante des bains fréquents, qui gardent la peau saine et reposent des fatigues.",B2,savait dj quil faut viter aliments grossiers lourdes venaisons boissons fermentes connaissait aussi linfluence bienfaisante bains frquents gardent peau saine reposent fatigues
1174,C'est la jungle.,A2,cest jungle
1175,"SpaceX, officiellement Space Exploration Technologies Corporation, est une entreprise américaine spécialisée dans le domaine de l'astronautique et du vol spatial.",C1,spacex officiellement space exploration technologies corporation entreprise amricaine spcialise domaine lastronautique vol spatial
1176,La merveilleuse paix de cet été endormi entrait en moi comme une marée.,C2,merveilleuse paix cet endormi entrait comme mare
1177,"""Aujourd'hui nous magnifions les robots pour faciliter leur future acceptation sociale"", relève le psychiatre Serge Tisseron de l'université Paris-VII, dans le magazine Les dossiers de la Recherche. Mais cette forte empathie peut avoir son revers.",C2,aujourdhui magnifions robots faciliter future acceptation sociale relve psychiatre serge tisseron luniversit parisvii magazine dossiers recherche cette forte empathie peut avoir revers
1178,Les dernières semaines avant Noël se déroulent dans une ambiance joyeuse et féérique,B2,dernires semaines avant nol droulent ambiance joyeuse frique
1179,Or ces mêmes statistiques en témoignent :on trouve,C1,or mmes statistiques tmoignent trouve
1180,"Mais, déjà, le commerce équitable commence à être récupéré par des entrepreneurs au nez creux et peu soucieux de respecter les critères fondamentaux, trop contraignants.",C1,dj commerce quitable commence tre rcupr entrepreneurs nez creux peu soucieux respecter critres fondamentaux trop contraignants
1181,C'est les discussions d'aujourd'hui.,A2,cest discussions daujourdhui
1182,Cette assurance me calma ; je sentis ma douleur s'apaiser.,C2,cette assurance calma sentis douleur sapaiser
1183,Papa raconte une histoire aux enfants pour les endormir.,A1,papa raconte histoire enfants endormir
1184,"Mis en place par l'éco-organisme Récylum, ce dispositif intéresse en premier lieu les entreprises du bâtiment, mais aussi les industries et les collectivités territoriales, qui détiennent du matériel (alarmes incendie, caméras de surveillance) qui ne fonctionne plus.",B2,mis place lcoorganisme rcylum dispositif intresse premier lieu entreprises btiment aussi industries collectivits territoriales dtiennent matriel alarmes incendie camras surveillance fonctionne plus
1185,J'en conclus que les Réalistes de talent devraient s'appeler plutôt des Illusionnistes.,C1,jen conclus ralistes talent devraient sappeler plutt illusionnistes
1186,"Vous ouvrîtes la boîte à musique et découvrîtes un bijou, serti de pierres précieuses multicolors.",C1,ouvrtes bote musique dcouvrtes bijou serti pierres prcieuses multicolors
1187,"Si nous avions eu suffisament d'argent, nous aurions pris l'avion pour nous rendre à notre conférence sur les enjeux écologiques du siècle et ainsi participer activement au débat.",B2,si suffisament dargent pris lavion rendre confrence enjeux cologiques sicle ainsi participer activement dbat
1188,Je ne veux pas.,A1,veux
1189,La journée est longue pour David qui attend le samedi toute la semaine.,A2,journe longue david attend samedi toute semaine
1190,"Nous souhaitons favoriser davantage la création et l'ouverture à d'autres publics"", explique Nathalie Perrin-Gilbert.",C1,souhaitons favoriser davantage cration louverture dautres publics explique nathalie perringilbert
1191,Je me réjouis de te revoir pendant les vacances.,A2,rjouis revoir pendant vacances
1192,"De fait, les relations de l'individu au groupe, du privé au collectif, demeurent complexes dans l'Hexagone.",B2,fait relations lindividu groupe priv collectif demeurent complexes lhexagone
1193,Il était une fois une petite fille de village.,A2,tait fois petite fille village
1194,L'addition s'il-vous-plaît !,A1,laddition silvousplat
1195,"Ils doivent également présenter, le cas échéant, les documents justifiant de l'objet et des conditions de leur séjour",C1,doivent galement prsenter cas chant documents justifiant lobjet conditions sjour
1196,Un petit garçon : On essaye de leur parler,A2,petit garon essaye parler
1197,Le couple a bien fait d'évacuer,A2,couple a bien fait dvacuer
1198,"Lorsqu'elle eut revu son premier amoureux, son coeur battit follement",C2,lorsquelle revu premier amoureux coeur battit follement
1199,"De fait, en scindant son enseignement supérieur en deux systèmes concurrents, la France a créé une hiérarchie dans toutes les têtes: la grande école est synonyme de réussite, l'université de rebut.",C2,fait scindant enseignement suprieur deux systmes concurrents france a cr hirarchie toutes ttes grande cole synonyme russite luniversit rebut
1200,On le trouvera ridicule et ce sera une catastrophe.,B1,trouvera ridicule catastrophe
1201,Qu'est-ce que vous avez comme tartes ?,A1,questce comme tartes
1202,On partait de bonne heure pour ne pas être coincés dans les embouteillages,A2,partait bonne heure tre coincs embouteillages
1203,La FAO (Organisation pour l'alimentation et l'agriculture) estime que 95 % des personnes victimes de sous-alimentation chronique vivent dans les pays en voie de développement.,C1,fao organisation lalimentation lagriculture estime personnes victimes sousalimentation chronique vivent pays voie dveloppement
1204,"On vient d'acheter une résidence secondaire, au Pays basque, qui sera notre point de ralliement familial.",C1,vient dacheter rsidence secondaire pays basque point ralliement familial
1205,"L'échange, c'est-à-dire l'interaction verbale, se présente comme une co-construction constitutive de la dynamique du groupe ; c'est en tenant compte des interlocuteurs et de la façon dont ils se positionnent les uns vis-à-vis des autres, selon les objets et les enjeux des interactions, que l'on envisage d'analyser tant la variation des usages en présence que l'hétérogénéité constitutive du dire, dans cet espace.",C2,lchange cestdire linteraction verbale prsente comme coconstruction constitutive dynamique groupe cest tenant compte interlocuteurs faon dont positionnent uns visvis autres selon objets enjeux interactions lon envisage danalyser tant variation usages prsence lhtrognit constitutive dire cet espace
1206,Mon mari a enfin trouvé une place d'architecte et travaille sur un important projet d'immeuble avec son équipe,B1,mari a enfin trouv place darchitecte travaille important projet dimmeuble quipe
1207,C'est somptueux.,A2,cest somptueux
1208,Bonne chance !,A1,bonne chance
1209,J'ouvrais la porte et le chien courait à l'extérieur.,A2,jouvrais porte chien courait lextrieur
1210,"Mais qu'ils prétendent être les seuls acteurs légitimes pour définir et normaliser le commerce équitable, c'est nier les autres pratiques et refuser le débat avec tous les acteurs de la société civile, ce qui est inadmissible.",C1,quils prtendent tre seuls acteurs lgitimes dfinir normaliser commerce quitable cest nier autres pratiques refuser dbat tous acteurs socit civile inadmissible
1211,"Non, Je ne parle pas français.",A1,non parle franais
1212,Il est tombé malade l'année précédant son mariage.,B2,tomb malade lanne prcdant mariage
1213,Les maires ont ainsi voulu montrer qu'ils les avaient à l'oeil.,B1,maires ainsi voulu montrer quils loeil
1214,"Il allait devoir passer l'hiver ici, dans la forêt, en attendant d'être guérit.",B1,allait devoir passer lhiver ici fort attendant dtre gurit
1215,Il est très fâché parce qu'elle ne lui a pas répondu au téléphone.,A1,trs fch parce quelle a rpondu tlphone
1216,"Celui-ci, ancien soldat, devinant d'abord le plan de campagne de son interlocuteur, parla des protections qu'avait son maître, ajoutant que, certes, on ne lui chiperait pas ses beaux chevaux.",C1,celuici ancien soldat devinant dabord plan campagne interlocuteur parla protections quavait matre ajoutant certes chiperait beaux chevaux
1217,Je ne te crois pas.,A1,crois
1218,Le journal a été emporté par un coup de vent.,B1,journal a emport coup vent
1219,"Les optimistes soulignent qu'il ne représente encore qu'une part infinitésimale des échanges internationaux mais que le concept est ""porteur"".",C1,optimistes soulignent quil reprsente encore quune part infinitsimale changes internationaux concept porteur
1220,"Sans y penser, j'ai fait des erreurs !",B1,sans penser jai fait erreurs
1221,"Quand tu sors de l'ascenseur, tourne à droite et encore à droite.",A2,quand sors lascenseur tourne droite encore droite
1222,"Et il regardait tous ces hommes attablés et buvant, tous ces hommes qui pouvaient se désaltérer tant qu'il leur plaisait.",B2,regardait tous hommes attabls buvant tous hommes pouvaient dsaltrer tant quil plaisait
1223,Elle a préparé les photocopies pour les participants à la réunion de l'après-midi,B1,a prpar photocopies participants runion laprsmidi
1224,"Ainsi, Madame, qui est irlandaise et vit à lieu, témoigne : ""En France, si je parle anglais à mon fils, il me répond plutôt en français.",B1,ainsi madame irlandaise vit lieu tmoigne france si parle anglais fils rpond plutt franais
1225,Capacités intellectuelles ou problèmes d'orientation ?,B2,capacits intellectuelles problmes dorientation
1226,A affronter ce monde et l'améliorer.,A2,a affronter monde lamliorer
1227,"Deux guerres mondiales, en 1914 et 1939, convainquirent cependant de nombreux Européens que le Concert européen avait échoué et ne parvenait plus à gérer les affaires du continent.",C2,deux guerres mondiales convainquirent cependant nombreux europens concert europen chou parvenait plus grer affaires continent
1228,Il y a des cours de portugais.,A1,a cours portugais
1229,Les spécialistes de la violence chez les adolescents rappellent qu'il est dangereux de les considérer comme une armée menaçante.,B1,spcialistes violence chez adolescents rappellent quil dangereux considrer comme arme menaante
1230,"Malheureusement, il ne s'agit que de moyenne.",B1,malheureusement sagit moyenne
1231,Le paysage devient tout blanc à cause de la neige et de la glace.,A1,paysage devient tout blanc cause neige glace
1232,"L'après-midi, j'ai encore beaucoup de choses à faire",A2,laprsmidi jai encore beaucoup choses faire
1233,"De fait, la nature peut être, par l'homme, changée tout à fait, transformée, ébranlée jusqu'en ses fondements, et c'est pourquoi il sied de réhabiliter le mot de magie, en lui redonnant le sens honorable qu'il avait autrefois et en désignant par là une science justement ambitieuse qui, de la connaissance des formes cachées, déduit des opérations étonnantes.",C2,fait nature peut tre lhomme change tout fait transforme branle jusquen fondements cest pourquoi sied rhabiliter mot magie redonnant sens honorable quil autrefois dsignant science justement ambitieuse connaissance formes caches dduit oprations tonnantes
1234,Le bleu est très présent dans la nature : c'est la couleur du ciel et de la mer.,A1,bleu trs prsent nature cest couleur ciel mer
1235,"Elle fais ses devoirs puis prépare le dîner et finalement, elle regarde un film avant d'aller se coucher.",A2,fais devoirs puis prpare dner finalement regarde film avant daller coucher
1236,Pas de fête avec vous ce soir,A1,fte soir
1237,Je n'arrive plus à dormir depuis quelques jours à cause de mes voisins et leurs travaux.,A2,narrive plus dormir depuis quelques jours cause voisins leurs travaux
1238,"C'était une chétive créature, une masse de chair ridée, avec des paupières entre-closes, des traits informes et à peine ébauchés.",C2,ctait chtive crature masse chair ride paupires entrecloses traits informes peine bauchs
1239,J'aime les pommes de terre.,A1,jaime pommes terre
1240,Elle a juste miaulé craintivement et s'est recroquevillée sur sa branche oú elle se trouve.,B2,a juste miaul craintivement sest recroqueville branche o trouve
1241,"Mesdames, messieurs, votre attention s'il vous plaît.",A2,mesdames messieurs attention sil plat
1242,"En cinquante ans, les progrès accomplis par les techniques de l'information ont entraîné une amplification extraordinaire des flux d'informations.",C1,cinquante ans progrs accomplis techniques linformation entran amplification extraordinaire flux dinformations
1243,Je regarde un film en allemand.,A1,regarde film allemand
1244,Les vacances sont les moments préférés de Pierre car il a pour habitude d'aller chez ses grands-parents qui vivent dans une ferme de la campagne normande,A1,vacances moments prfrs pierre car a habitude daller chez grandsparents vivent ferme campagne normande
1245,Figurez-vous un Turc allant la nuit chez Paul Niquet!,B2,figurezvous turc allant nuit chez paul niquet
1246,La comtesse s'était passionnée pour le caractère primitif et pour l'astrologie de l'abbé Blanès.,C1,comtesse stait passionne caractre primitif lastrologie labb blans
1247,"Pour dissuader ses lycéens de faire les Beaux-arts, l'École du cirque ou un diplôme d'arts du spectacle, un proviseur avait coutume de leur raconter cette histoire : ""J'avais deux copains",C1,dissuader lyceens faire beauxarts lecole cirque diplome darts spectacle proviseur coutume raconter cette histoire javais deux copains
1248,"Perrette, retenant sa respiration tellement était forte l'odeur nauséabonde d'huile de vidange, dans la chambre-garage.",C1,perrette retenant respiration tellement tait forte lodeur nausabonde dhuile vidange chambregarage
1249,"Néanmoins, l'introduction de la notion de genre dans la santé entraîne une meilleure compréhension des processus biologiques et sociaux intriqués qui influencent les trajectoires de santé des hommes et des femmes.",C1,nanmoins lintroduction notion genre sant entrane meilleure comprhension processus biologiques sociaux intriqus influencent trajectoires sant hommes femmes
1250,"Pour conjurer les deux mois de vacances, ils achètent donc leur potion en librairie pour un investissement moyen de 7 euros",C2,conjurer deux mois vacances achetent donc potion librairie investissement moyen euros
1251,Le courant d'air ainsi créé permet à la sueur - qui absorbe la chaleur du corps - de s'évaporer et ainsi de le refroidir.,B1,courant dair ainsi cr permet sueur absorbe chaleur corps svaporer ainsi refroidir
1252,"La pelle, les pincettes et le bec du soufflet, tous de proportion colossale, brillaient comme de l'acier poli, tandis que le long des murs s'étendait une abondante batterie de cuisine, où miroitait inégalement la flamme claire du foyer, jointe aux premières lueurs du soleil arrivant par les carreaux.",C2,pelle pincettes bec soufflet tous proportion colossale brillaient comme lacier poli tandis long murs stendait abondante batterie cuisine o miroitait ingalement flamme claire foyer jointe premires lueurs soleil arrivant carreaux
1253,Mais les chiens et les chats ne s'aiment pas beaucoup .,A1,chiens chats saiment beaucoup
1254,"Il s'offre les meilleurs guides, gravit les montagnes, s'épanouit",C1,soffre meilleurs guides gravit montagnes sepanouit
1255,Les préadolescents et adolescents semblent particulièrement sensibles.,B2,pradolescents adolescents semblent particulirement sensibles
1256,"Les cordes vocales, ce sont des muscles, hein, et donc, j'ai un entraînement quotidien parce qu'on doit être raccord avec des enregistrements qui ont quelquefois 10 voire 15 ans",B2,cordes vocales muscles hein donc jai entranement quotidien parce quon doit tre raccord enregistrements quelquefois voire ans
1257,"Elle trouvait ça drôle, finissait par rire, et, s'animant, commençait à trottiner derrière lui, avec de légers cris joyeux et craintifs, quand elle 143 avait cru le saisir.",C2,trouvait a drle finissait rire sanimant commenait trottiner derrire lgers cris joyeux craintifs quand cru saisir
1258,Il est en train de ranger ses affaires.,A2,train ranger affaires
1259,"Tout comme la révolution industrielle a vu naître le capitalisme, je suis persuadé que la robolution va profondément modifier notre système économique.",B2,tout comme rvolution industrielle a vu natre capitalisme persuad robolution va profondment modifier systme conomique
1260,"On a ainsi constaté, chez les femmes urbaines de haut niveau socio-économique, au Brésil, 28 % de réduction de la surcharge pondérale de 1989 à 1997.",C1,a ainsi constat chez femmes urbaines haut niveau socioconomique brsil rduction surcharge pondrale
1261,Cette réponse me bouleversa.,C2,cette rponse bouleversa
1262,"[Les dames rient] Je pense qu'il y aurait de la bagarre, hein",A2,dames rient pense quil bagarre hein
1263,"Tu ne mérites pas d'en manger, dit l'autre.",A2,mrites den manger dit lautre
1264,"Jeune retraité de l'éducation nationale, Roger Rougier a sa réponse.",C1,jeune retrait lducation nationale roger rougier a rponse
1265,Tout se passe bien en France ?,B1,tout passe bien france
1266,"Non, elle est fleuriste.",A1,non fleuriste
1267,"Sans enfants à cinquante-neuf ans, Guido avait, de son propre coeur, préparé pour son enfant à venir un coeur modelé sur sa propre préoccupation : l'hommage sans remords à la noblesse, la génuflexion que fait par contraction musculaire le corps pourchassé en s'affalant devant ce qui est imminent et inaccessible comme devant une grande chaleur.",C2,sans enfants cinquanteneuf ans guido propre coeur prpar enfant venir coeur model propre proccupation lhommage sans remords noblesse gnuflexion fait contraction musculaire corps pourchass saffalant devant imminent inaccessible comme devant grande chaleur
1268,Le plat plein ploie sous le poids ou ne ploie point ?,C2,plat plein ploie sous poids ploie point
1269,"Et vous l'entendez, ce violon qui joue du klezmer, la musique traditionnelle des juifs itinérants ?",B2,lentendez violon joue klezmer musique traditionnelle juifs itinrants
1270,"Un principe qui concerne déjà de nombreux produits tels que les emballages, les textiles et les pneus.",B2,principe concerne dj nombreux produits tels emballages textiles pneus
1271,"Non, bien sûr que non.",A2,non bien sr non
1272,J'ai une soeur,A1,jai soeur
1273,Et j'adresse un défi collectif au parterre !,B2,jadresse dfi collectif parterre
1274,"En étant connecté en permanence à ses amis et en pouvant ""se raccrocher"" à des environnements en ligne familiers, comme sa page Facebook, son compte Twitter ou sa story Snapchat, la personne, éloignée de son environnement familier, ne se sentirait-elle pas alors davantage en sécurité affective, comme dans son foyer où elle a ses repères et habitudes rassurants ?",C2,tant connect permanence amis pouvant raccrocher environnements ligne familiers comme page facebook compte twitter story snapchat personne loigne environnement familier sentiraitelle alors davantage scurit affective comme foyer o a repres habitudes rassurants
1275,La blanquette est bonne.,A2,blanquette bonne
1276,L'Empereur était à Paris.,B1,lempereur tait paris
1277,"Je m'appelle Laurent et j'habite à Paris avec mes parents, ma soeur ainée et mon frère.",A2,mappelle laurent jhabite paris parents soeur aine frre
1278,"Puis, il y eut une pause lugubre, suivie d'un vaste soupir d'agonie où l'on eût dit que l'âme de la grosse cloche s'exhalait.",C2,puis pause lugubre suivie dun vaste soupir dagonie o lon dit lme grosse cloche sexhalait
1279,La règle du frein à l'endettement devrait traiter de manière symétrique les dépassements de dépenses et les économies réalisées.,C1,rgle frein lendettement devrait traiter manire symtrique dpassements dpenses conomies ralises
1280,"La spirale vicieuse, cette mécanique qui entraîne vers le bas, n'est pas, dans le discours des milieux populaires, liée à une conjoncture négative.",B2,spirale vicieuse cette mcanique entrane vers bas nest discours milieux populaires lie conjoncture ngative
1281,Ils ne se parlent plus depuis qu'ils se sont disputés.,B1,parlent plus depuis quils disputs
1282,"Pour Yak Rivais, le langage fait certes travailler le cerveau, mais aussi l'oeil et l'oreille.",B2,yak rivais langage fait certes travailler cerveau aussi loeil loreille
1283,"En brisant le fatum des itinéraires sociaux, en augmentant le temps de la formation, en accroissant l'autonomie des individus, les sociétés modernes ont inventé la jeunesse et celle-ci ne cesse de s'allonger, jusqu'à 25 ans et au-delà.",B2,brisant fatum itinraires sociaux augmentant temps formation accroissant lautonomie individus socits modernes invent jeunesse celleci cesse sallonger jusqu ans audel
1284,"Je ne me couche pas trop tard, vers minuit",A1,couche trop tard vers minuit
1285,"""Nous allons essayer à nouveau (ndlr: d'entrer en contact avec lui). Mais les chances de rétablir la liaison sont très très faibles"", a déclaré à l'AFP Stephan Ulamec, responsable de l'atterrisseur, depuis l'Agence spatiale européenne (ESA) à Darmstadt (Allemagne).",B2,allons essayer nouveau ndlr dentrer contact chances rtablir liaison trs trs faibles a dclar lafp stephan ulamec responsable latterrisseur depuis lagence spatiale europenne esa darmstadt allemagne
1286,"Ajoutons, pour parfaire ce tableau, que ces seniors ont reçu de la science la perspective d'un quart de siècle de longévité supplémentaire traversé en relative bonne santé.",B2,ajoutons parfaire tableau seniors reu science perspective dun quart sicle longvit supplmentaire travers relative bonne sant
1287,"Une fois ces déclencheurs identifiés, il faut alors élaborer des stratégies pour les éviter ou y faire face.",C2,fois dclencheurs identifis faut alors laborer stratgies viter faire face
